{
  "schema_version": 1,
  "contract_id": "goreecloud.privacy-shield.provider-evidence-review.v1",
  "review_id": "foundationdb-operational-security-review-20260919",
  "evidence_id": "foundationdb-operational-security-docs-20260919",
  "evidence_ref": "evidence+sha256:0ca034c0f7618b2684006f0b6dc47c8720de410b36da131f3405e30b1806ca30:github://GoreeCloud/goreecloud-privacy-shield/evidence/provider-evaluations/foundationdb-operational-security-candidate-20260919.md",
  "provider_class": "state-provider",
  "provider_id": "foundationdb-self-hosted-multihost",
  "provider_name": "FoundationDB self-hosted multi-host cluster",
  "provider_implementation": "FoundationDB self-hosted multi-host cluster",
  "integration_authority": "GoreeCloud/privacy-shield",
  "scope": {
    "service": "privacy-shield",
    "capability": "durable-authorization-state",
    "authority_state": [
      "consent",
      "policy_versions_and_active_pointer",
      "capability_revocation",
      "single_use_capability_consumption",
      "privacy_evidence_and_chain_head"
    ],
    "environments": [
      "production"
    ]
  },
  "supports": [
    "restart_recovery",
    "migration_rollback",
    "access_control_isolation",
    "privacy_safe_observability",
    "operational_ownership"
  ],
  "review": {
    "decision": "accepted-for-evaluation",
    "review_authority": "GoreeCloud owner decision under authoritative software licensing and open-source governance",
    "review_authority_reference": "evidence+sha256:ee9cc15deb658a201b1769a52669eab442762245e061aae5cfcb96d289e6bd4e:github://GoreeCloud/goreecloud-privacy-shield/reviews/provider-evidence/goreecloud-owner-review-authority-20260919.md",
    "review_evidence_reference": "evidence+sha256:7deed5a783b92fe823a0efdf1963cc8a03d696410643498c1aaec5739fd990ef:github://GoreeCloud/goreecloud-privacy-shield/reviews/provider-evidence/foundationdb-operational-security-review-20260919.md",
    "reviewed_at": "2026-09-19T22:50:00Z",
    "valid_until": "2026-10-18T22:00:00Z"
  },
  "governance": {
    "status": "active",
    "authorizing": false,
    "provider_selection_authorized": false,
    "production_acceptance_authorized": false,
    "review_authority_validated_by_schema": false
  },
  "privacy": {
    "credentials_in_review": false,
    "secret_material_in_review": false,
    "raw_private_payloads_in_review": false,
    "full_capability_tokens_in_review": false
  },
  "limitations": [
    "Evidence acceptance preserves FoundationDB's documented absence of user-level access control and does not treat experimental tenants as a production security boundary.",
    "Evidence acceptance does not resolve any evaluation criterion or approve an external isolation architecture.",
    "Current one-VPS topology still blocks distributed production qualification."
  ]
}
