{
  "schema_version": 1,
  "contract_id": "goreecloud.privacy-shield.provider-evidence-review.v1",
  "review_id": "etcd-operational-profile-review-20261004",
  "evidence_id": "etcd-operational-profile-20261004",
  "evidence_ref": "evidence+sha256:1e65e73c1905ca85a23655e5d966ac7291fc30563e4ec09d118308442ac0b08c:github://GoreeCloud/privacy-shield/evidence/provider-evaluations/etcd-operational-profile-20261004.md",
  "provider_class": "state-provider",
  "provider_id": "etcd-self-hosted-multimember",
  "provider_name": "etcd self-hosted multi-member cluster",
  "provider_implementation": "etcd v3.7.2 self-hosted multi-member cluster",
  "integration_authority": "GoreeCloud/privacy-shield",
  "scope": {
    "service": "privacy-shield",
    "capability": "durable-authorization-state",
    "authority_state": [
      "consent",
      "policy_versions_and_active_pointer",
      "capability_revocation",
      "single_use_capability_consumption",
      "privacy_evidence_and_chain_head"
    ],
    "environments": [
      "production"
    ]
  },
  "supports": [
    "privacy_safe_observability",
    "operational_ownership"
  ],
  "review": {
    "decision": "accepted-for-evaluation",
    "review_authority": "GoreeCloud owner decision under current GoreeCloud operating, open-source, and licensing governance",
    "review_authority_reference": "evidence+sha256:102011f6aa807c7550bb640cdd69b899abed9f5a280bfa02557e4037e3ff5a02:github://GoreeCloud/privacy-shield/reviews/provider-evidence/goreecloud-owner-review-authority-20261004.md",
    "review_evidence_reference": "evidence+sha256:e031a4d0f7e3a50105302822074b4b7ff8b63c6811addab309290b843a9a8e2d:github://GoreeCloud/privacy-shield/reviews/provider-evidence/etcd-operational-profile-review-20261004.md",
    "reviewed_at": "2026-10-04T21:30:00Z",
    "valid_until": "2026-11-02T21:30:00Z"
  },
  "governance": {
    "status": "active",
    "authorizing": false,
    "provider_selection_authorized": false,
    "production_acceptance_authorized": false,
    "review_authority_validated_by_schema": false
  },
  "privacy": {
    "credentials_in_review": false,
    "secret_material_in_review": false,
    "raw_private_payloads_in_review": false,
    "full_capability_tokens_in_review": false
  },
  "limitations": [
    "Evidence acceptance is limited to candidate evaluation.",
    "Exact deployed controls and production acceptance remain separately required."
  ]
}
